{
	"header" : { "$ref" : "common/header.json" },
	"footer" : { "$ref" : "common/footer.json" },
	"content" : {
        "contentTitle" : "My Orders",
		"orderNumberTitle" : "Order Number",
		"dateTitle" : "Date",
		"paymentStatusTitle" : "Payment Status",
		"shippingTitle" : "Shipping",
		"order" : [
			{
				"orderNumber" : "1234567889952",
				"date" : "08.05.15",
				"total" : "100.00 €",
				"paymentStatus" : "Paid",
				"shipping" : "Delivered",
				"view" : "View"
			},
			{
				"orderNumber" : "1234567889952",
				"date" : "08.05.15",
				"total" : "100.00 €",
				"paymentStatus" : "Paid",
				"shipping" : "Delivered",
				"view" : "View"
			},
			{
				"orderNumber" : "1234567889952",
				"date" : "08.05.15",
				"total" : "100.00 €",
				"paymentStatus" : "Paid",
				"shipping" : "Delivered",
				"view" : "View"
			},
			{
				"orderNumber" : "1234567889952",
				"date" : "08.05.15",
				"total" : "100.00 €",
				"paymentStatus" : "Paid",
				"shipping" : "Delivered",
				"view" : "View"
			},
			{
				"orderNumber" : "1234567889952",
				"date" : "08.05.15",
				"total" : "100.00 €",
				"paymentStatus" : "Paid",
				"shipping" : "Delivered",
				"view" : "View"
			}
		]
	},
    "meta" : { "$ref" : "common/meta.json" }
}
