{
	"header" : { "$ref" : "common/header.json" },
	"footer" : { "$ref" : "common/footer.json" },
	"content" : {
		"suggestions" : [
			{
				"id" : "1",
				"name" : "Enditatem Product Name Optional very long line two",
				"description" : "Subline",
				"sku" : "Sunrise #SUN123456",
				"price" : "€ 49,-",
				"priceOld" : "€ 79,99",
				"rating2" : true,
				"url" : "",
				"addToCartUrl" : "",
				"addToWishlistUrl" : "",
				"addReviewUrl" : "",
				"new" : true,
				"moreColors" : true,
				"gallery" : {
					"mainImage" : "assets/img/blue-jacket.jpg",
					"list" : [
						{
							"thumbImage" : "assets/img/blue-jacket.jpg",
							"bigImage" : "assets/img/blue-jacket.jpg"
						},
						{
							"thumbImage" : "assets/img/blue-jacket.jpg",
							"bigImage" : "assets/img/blue-jacket.jpg"
						},
						{
							"thumbImage" : "assets/img/blue-jacket.jpg",
							"bigImage" : "assets/img/blue-jacket.jpg"
						},
						{
							"thumbImage" : "assets/img/blue-jacket.jpg",
							"bigImage" : "assets/img/blue-jacket.jpg"
						}
					]
				},
				"attributes" : [
					{
						"name" : "Color",
						"list" : [
							{
								"text" : "Red",
								"value" : "",
								"selected" : false
							},
							{
								"text" : "Blue",
								"value" : "",
								"selected" : false
							},
							{
								"text" : "Green",
								"value" : "",
								"selected" : false
							}
						]
					},
					{
						"name" : "Size",
						"list" : [
							{
								"text" : "S",
								"value" : "",
								"selected" : false
							},
							{
								"text" : "M",
								"value" : "",
								"selected" : false
							},
							{
								"text" : "L",
								"value" : "",
								"selected" : false
							}
						]
					}
				]
			},
			{
				"id" : "2",
				"name" : "Enditatem Product Name Optional very long line two",
				"description" : "Subline",
				"sku" : "Sunrise #SUN123456",
				"price" : "€ 49,-",
				"priceOld" : "€ 79,99",
				"rating2" : true,
				"url" : "",
				"addToCartUrl" : "",
				"addToWishlistUrl" : "",
				"addReviewUrl" : "",
				"new" : true,
				"moreColors" : true,
				"gallery" : {
					"mainImage" : "assets/img/blue-shirt.jpg",
					"list" : [
						{
							"thumbImage" : "assets/img/blue-shirt.jpg",
							"bigImage" : "assets/img/blue-shirt.jpg"
						},
						{
							"thumbImage" : "assets/img/blue-shirt.jpg",
							"bigImage" : "assets/img/blue-shirt.jpg"
						},
						{
							"thumbImage" : "assets/img/blue-shirt.jpg",
							"bigImage" : "assets/img/blue-shirt.jpg"
						},
						{
							"thumbImage" : "assets/img/blue-shirt.jpg",
							"bigImage" : "assets/img/blue-shirt.jpg"
						}
					]
				},
				"attributes" : [
					{
						"name" : "Color",
						"list" : [
							{
								"text" : "Red",
								"value" : "",
								"selected" : false
							},
							{
								"text" : "Blue",
								"value" : "",
								"selected" : false
							},
							{
								"text" : "Green",
								"value" : "",
								"selected" : false
							}
						]
					},
					{
						"name" : "Size",
						"list" : [
							{
								"text" : "S",
								"value" : "",
								"selected" : false
							},
							{
								"text" : "M",
								"value" : "",
								"selected" : false
							},
							{
								"text" : "L",
								"value" : "",
								"selected" : false
							}
						]
					}
				]
			},
			{
				"id" : "3",
				"name" : "Enditatem Product Name Optional very long line two",
				"description" : "Subline",
				"sku" : "Sunrise #SUN123456",
				"price" : "€ 49,-",
				"priceOld" : "€ 79,99",
				"rating2" : true,
				"url" : "",
				"addToCartUrl" : "",
				"addToWishlistUrl" : "",
				"addReviewUrl" : "",
				"new" : true,
				"moreColors" : true,
				"gallery" : {
					"mainImage" : "assets/img/blue-jacket.jpg",
					"list" : [
						{
							"thumbImage" : "assets/img/blue-jacket.jpg",
							"bigImage" : "assets/img/blue-jacket.jpg"
						},
						{
							"thumbImage" : "assets/img/blue-jacket.jpg",
							"bigImage" : "assets/img/blue-jacket.jpg"
						},
						{
							"thumbImage" : "assets/img/blue-jacket.jpg",
							"bigImage" : "assets/img/blue-jacket.jpg"
						},
						{
							"thumbImage" : "assets/img/blue-jacket.jpg",
							"bigImage" : "assets/img/blue-jacket.jpg"
						}
					]
				},
				"attributes" : [
					{
						"name" : "Color",
						"list" : [
							{
								"text" : "Red",
								"value" : "",
								"selected" : false
							},
							{
								"text" : "Blue",
								"value" : "",
								"selected" : false
							},
							{
								"text" : "Green",
								"value" : "",
								"selected" : false
							}
						]
					},
					{
						"name" : "Size",
						"list" : [
							{
								"text" : "S",
								"value" : "",
								"selected" : false
							},
							{
								"text" : "M",
								"value" : "",
								"selected" : false
							},
							{
								"text" : "L",
								"value" : "",
								"selected" : false
							}
						]
					}
				]
			},
			{
				"id" : "4",
				"name" : "Enditatem Product Name Optional very long line two",
				"description" : "Subline",
				"sku" : "Sunrise #SUN123456",
				"price" : "€ 49,-",
				"priceOld" : "€ 79,99",
				"rating2" : true,
				"url" : "",
				"addToCartUrl" : "",
				"addToWishlistUrl" : "",
				"addReviewUrl" : "",
				"new" : true,
				"moreColors" : true,
				"gallery" : {
					"mainImage" : "assets/img/blue-shirt.jpg",
					"list" : [
						{
							"thumbImage" : "assets/img/blue-shirt.jpg",
							"bigImage" : "assets/img/blue-shirt.jpg"
						},
						{
							"thumbImage" : "assets/img/blue-shirt.jpg",
							"bigImage" : "assets/img/blue-shirt.jpg"
						},
						{
							"thumbImage" : "assets/img/blue-shirt.jpg",
							"bigImage" : "assets/img/blue-shirt.jpg"
						},
						{
							"thumbImage" : "assets/img/blue-shirt.jpg",
							"bigImage" : "assets/img/blue-shirt.jpg"
						}
					]
				},
				"attributes" : [
					{
						"name" : "Color",
						"list" : [
							{
								"text" : "Red",
								"value" : "",
								"selected" : false
							},
							{
								"text" : "Blue",
								"value" : "",
								"selected" : false
							},
							{
								"text" : "Green",
								"value" : "",
								"selected" : false
							}
						]
					},
					{
						"name" : "Size",
						"list" : [
							{
								"text" : "S",
								"value" : "",
								"selected" : false
							},
							{
								"text" : "M",
								"value" : "",
								"selected" : false
							},
							{
								"text" : "L",
								"value" : "",
								"selected" : false
							}
						]
					}
				]
			}
		],
		"wishlistWidged" : {
			"text" : "Your Wishlist",
			"number" : "45",
			"recentAddedTitle" : "My recently added items",
			"viewWishlist" : {
				"text" : "View your wishlist",
				"url" : ""
			},
			"list" : [
				{
					"image" : "assets/img/blue-shirt.jpg"
				},
				{
					"image" : "assets/img/blue-shirt.jpg"
				},
				{
					"image" : "assets/img/blue-shirt.jpg"
				}
			]
		}
	},
	"meta" : {
		"assetsPath": "assets/",
		"bagItems" : [ 1, 2, 3, 4, 5, 6, 7, 8, 9 ]
	}
}
