{
    "header" : { "$ref" : "common/checkout-header.json" },
    "footer" : { "$ref" : "common/checkout-footer.json" },
    "content" : {
        "stepWidget" : {
            "paymentStepActive": true
        },
        "paymentOption" : {
            "list" : [
                {
                    "text" : "Credit Card",
                    "image" : "assets/img/payment-option-card.gif",
                    "value" : "credit-card",
                    "selected" : false
                },
                {
                    "text" : "PayPal",
                    "image" : "assets/img/payment-option-paypal.png",
                    "value" : "paypal",
                    "selected" : false
                },
                {
                    "text" : "Pre-payment",
                    "image" : "assets/img/blank-img.jpg",
                    "value" : "prepaid",
                    "selected" : true
                }
            ]
        },
        "expiryDate" : { "$ref" : "checkout/months.json" },
        "year" : {
            "list" : [
                {
                    "text" : "2050",
                    "value" : "",
                    "selected" : false
                },
                {
                    "text" : "2100",
                    "value" : "",
                    "selected" : false
                }
            ]
        },
        "securityCode" : "Security Code",
        "securityCodeTooltip" : "Additional information about the security code goes here...",
        "cart" : { "$ref" : "checkout/cart.json" }
    },
    "meta" : {
        "assetsPath": "assets/"
    }
}
