{
	"header" : { "$ref" : "common/header.json" },
	"footer" : { "$ref" : "common/footer.json" },
	"content" : {
		"pageTitle" : "My Account",
		"sidebarItemOne" : {
			"text" : "Personal Details",
			"url" : ""
		},
		"sidebarItemTwo" : {
			"text" : "Address Book",
			"url" : ""
		},
		"sidebarItemThree" : {
			"text" : "Payment Details",
			"url" : ""
		},
		"sidebarItemFour" : {
			"text" : "My Orders",
			"url" : ""
		},
		"sidebarItemFive" : {
			"text" : "Returns / Exchange",
			"url" : ""
		},
		"sidebarItemSix" : {
			"text" : "Wishlist",
			"url" : "",
			"wishlistItems" : "12"
		},
		"sidebarItemSeven" : {
			"text" : "Sign Out",
			"url" : ""
		},
        "contentTitle" : "My Wishlist:",
		"itemsInTotal" : "3 items in total",
		"clearWishlistBtn" : "Clear Wishlist",
		"removeBtn" : "Remove",
        "pagination" : { "$ref" : "catalog/pagination.json" },
        "display" : {
            "title" : "Items per page",
            "list" : [
                {
                    "name" : "12",
                    "value" : "12",
                    "selected" : false
                },
                {
                    "name" : "24",
                    "value" : "24",
                    "selected" : true
                },
                {
                    "name" : "48",
                    "value" : "48",
                    "selected" : false
                }
            ]
        },
		"products" : { "$ref" : "catalog/product-list3.json" }
	},
    "meta" : { "$ref" : "common/meta.json" }
}
