{
	"header" : {
		"title" : "Sunrise - Checkout Sign In Page",
		"customerService" : "Need help? Customer Service",
		"customerServiceNumber" : "+12 345 6000"
	},
	"footer" : {
		"legalInfo" : {
			"text" : "Â© 2015 Sunrise",
			"list" : [
				{
					"text" : "Imprint",
					"url" : ""
				},
				{
					"text" : "Privacy policy",
					"url" : ""
				},
				{
					"text" : "Terms of use",
					"url" : ""
				}
			]
		}
	},
  "content" : {
    "secureCheckoutTitle" : "Secure Checkout - Sign In"
  },
  "meta" : {
    "assetsPath": "assets/"
  }
}
