{
    "header" : { "$ref" : "common/header.json" },
    "footer" : { "$ref" : "common/footer.json" },
    "content" : {
        "breadcrumb" : { "$ref" : "catalog/breadcrumb.json" },
        "suggestions" : { "$ref" : "catalog/product-list4.json" }
    },
    "meta" : { "$ref" : "common/meta.json" }
}
